{"authority":"NONE","candidate_ref":"git:6edb3a2ac4dd1ce7a2595fe47c5ba8d8c7a47f21","disposition":"FAIL","evaluated_at":"2026-09-07T18:10:19.563Z","evaluation_id":"eval:ca370a16-a94f-4c23-a5a8-2d4194a50d88","evaluator":{"evaluator_id":"evaluator:sscm-holdout-v0.1","independence_class":"INDEPENDENT"},"evidence_refs":["sscm:evaluator-worktree-head:6edb3a2ac4dd1ce7a2595fe47c5ba8d8c7a47f21","sscm:acceptance-profile:sscm-repair-dogfood.v0.1:sha256:1d52206e5c69a809661c1bf9ec9c9337f45b725f2cabd2021d9195b8a8f81dcb","sscm:observed-file:docs/sscm-repair-dogfood.txt:sha256:875b389ff9159d2ff087a4bc428aab7eb519684d4675cc090508336985a002c6","sscm:expected-condition:sha256:f195483e251af734990c006b46e136ca0c907d0699d1b078c5cf0213a5cdefa3","sscm:evaluation-run:evalrun-ddf83121-4097-4763-893d-578335c3d067:runtime:sovereign.deterministic-evaluator","sscm:evaluation-result:FAIL"],"findings":["exact-content mismatch for docs/sscm-repair-dogfood.txt: observed sha256 875b389ff915 != expected sha256 f195483e251a"],"schema_version":"sovereign.evaluation.v0.1"}
