{"authority":"NONE","candidate_ref":"git:2a93e1d66b7a3c3edb4dc069e0fe2ff5c3d97f06","disposition":"PASS","evaluated_at":"2026-09-07T18:11:05.370Z","evaluation_id":"eval:e76a438d-a6ba-48ea-bd97-37beaef4eb94","evaluator":{"evaluator_id":"evaluator:sscm-holdout-v0.1","independence_class":"INDEPENDENT"},"evidence_refs":["sscm:evaluator-worktree-head:2a93e1d66b7a3c3edb4dc069e0fe2ff5c3d97f06","sscm:acceptance-profile:sscm-repair-dogfood.v0.1:sha256:1d52206e5c69a809661c1bf9ec9c9337f45b725f2cabd2021d9195b8a8f81dcb","sscm:observed-file:docs/sscm-repair-dogfood.txt:sha256:f195483e251af734990c006b46e136ca0c907d0699d1b078c5cf0213a5cdefa3","sscm:expected-condition:sha256:f195483e251af734990c006b46e136ca0c907d0699d1b078c5cf0213a5cdefa3","sscm:evaluation-run:evalrun-888e3efd-ad51-45dc-a7ee-dff9a8d74126:runtime:sovereign.deterministic-evaluator","sscm:evaluation-result:PASS"],"findings":[],"schema_version":"sovereign.evaluation.v0.1"}
